<?xml version='1.0' encoding='UTF-8' ?>

<!--Generated by Turbo XML 2.4.1.100.-->

<!--*****************************************************************************
PUBLIC "-//EPO//PACKAGE INDEX 1.0//EN" "package-index-v1-0.dtd"
*****************************************************************************

********************************
* REVISION HISTORY
*********************************
* DATE: 17-02-2014
- Initial version

*****************************************************************************
* SECTION I - DTD
*****************************************************************************

Describes the contents of a package or batch-->
<!ELEMENT legstat-package-index (legstat-package-file+)>

<!--The name of the file containing the current xml instance.-->
<!ATTLIST legstat-package-index date-produced CDATA  #IMPLIED>

<!ATTLIST legstat-package-index dtd-version   CDATA  #IMPLIED>

<!ATTLIST legstat-package-index file          CDATA  #IMPLIED>

<!ATTLIST legstat-package-index id            ID     #IMPLIED>

<!ATTLIST legstat-package-index produced-by   CDATA  #IMPLIED>

<!ATTLIST legstat-package-index volume-id     CDATA  #IMPLIED>

<!--Describes the contents and location of each file within a package.-->
<!ELEMENT legstat-package-file (filename , file-location , doc-id? , subdocs? , imginfo? , legstat-doc-range+)>

<!ATTLIST legstat-package-file  id     ID     #IMPLIED
                                format  (xml | 
                                         tif | 
                                         pdf | 
                                         txt | 
                                         other | 
                                         zip | 
                                         nrm )  #IMPLIED
                                size   CDATA  #IMPLIED >
<!--The name of the physical file.-->
<!ELEMENT filename (#PCDATA)>

<!ATTLIST filename  id ID  #IMPLIED >
<!--The location (url or path) of the file.-->
<!ELEMENT file-location (#PCDATA)>

<!ATTLIST file-location  relative   (true | false )  #IMPLIED >
<!ELEMENT legstat-doc-range (legstat-first-doc-in-range , legstat-last-doc-in-range)>

<!ATTLIST legstat-doc-range  country CDATA  #IMPLIED >
<!ELEMENT legstat-first-doc-in-range (country , doc-number , kind , date)>

<!ELEMENT legstat-last-doc-in-range (country , doc-number , kind , date)>

<!--Document identification refers to patents (and patent applications) only.
See WIPO ST.14
-->
<!ELEMENT doc-id (country , doc-number , kind? , republication-code? , name? , date?)>

<!ATTLIST doc-id  lang     CDATA  #IMPLIED
                    doc-type  (A | P )  #IMPLIED >
<!--Country: use ST.3 country code; e.g. DE, FR, GB, NL, etc.
Also includes EP, WO. Always in upper case. Also can use "stateless"
-->
<!ELEMENT country (#PCDATA)>

<!--The number of the referenced patent (or application) document
-->
<!ELEMENT doc-number (#PCDATA)>

<!--Document kind code; e.g., A1
(INID 13, ST.32:B130)
-->
<!ELEMENT kind (#PCDATA)>

<!--WIPO ST 50 Republication code: NW (for new publications), W1, W2, Z1, Z2, etc...-->
<!ELEMENT republication-code (#PCDATA)>

<!--Name:
If no distinction or detail can be given.
Also to be used for: personal (natural person) and corporate (legal entity) names
-->
<!ELEMENT name (#PCDATA)>

<!ATTLIST name  name-type  (legal | natural )  #IMPLIED >
<!--Date: components of a date. Format: YYYYMMDD
-->
<!ELEMENT date (#PCDATA)>

<!ELEMENT subdocs (subdoc+)>

<!ELEMENT subdoc (#PCDATA)>

<!ATTLIST subdoc  subdoc-code CDATA  #IMPLIED
                    lang        CDATA  #IMPLIED
                    id          ID     #IMPLIED >
<!--For image files, specify also the height, width, etc... in mm of the image.-->
<!ELEMENT imginfo EMPTY>

<!--frame: WIPO ST 33 frame number
page: page number
he: height in mm, for image files
wi: width in mm, for image files-->
<!ATTLIST imginfo he    CDATA  #IMPLIED>

<!ATTLIST imginfo wi    CDATA  #IMPLIED>

<!ATTLIST imginfo page  CDATA  #IMPLIED>

<!ATTLIST imginfo frame CDATA  #IMPLIED>


